{
  "$schema": "http://json-schema.org/draft-07/schema#",
  "$id": "https://crux.studio/contracts/audio/pipeline.v0.schema.json",
  "title": "Thứ tự công đoạn của xưởng Âm thanh — v0",
  "description": "Kiến trúc (a) của mục audio/AU-007: công đoạn mỗi tập của xưởng giọng = chuẩn hoá văn bản → TTS bằng giọng khoá trong Channel Pack → kiểm ASR/độ to/độ dài → làm lại tối đa theo tham số R7d → xuất mốc thời gian từng từ; chạy TRƯỚC cổng hình storyboard/Preflight. Ghi vào contract (máy đọc được) chứ không chỉ trong tài liệu — ops/scripts/check-audio-pipeline.ts kiểm đúng thứ tự này.",
  "type": "object",
  "additionalProperties": false,
  "required": ["version", "runsBefore", "stages"],
  "properties": {
    "$note": { "type": "string" },
    "version": { "type": "integer", "minimum": 0 },
    "runsBefore": {
      "type": "string",
      "const": "storyboard-preflight",
      "description": "Xưởng giọng chạy trước cổng hình (storyboard/Preflight)."
    },
    "stages": {
      "type": "array",
      "minItems": 1,
      "items": {
        "type": "object",
        "additionalProperties": false,
        "required": ["id", "description", "usesProvider"],
        "properties": {
          "id": {
            "type": "string",
            "enum": ["normalize", "tts", "verify", "retry", "timestamps"]
          },
          "description": { "type": "string", "minLength": 1 },
          "usesProvider": {
            "type": "boolean",
            "description": "Công đoạn có cần nhà cung cấp (providers.tts) không. `normalize` là false nên chạy được ở Đợt 0."
          },
          "retryParam": {
            "type": "string",
            "description": "Chỉ ở công đoạn 'retry': tham số trần số lần làm lại (R7d)."
          }
        }
      }
    }
  }
}
